{
    "$schema": "stack.schema.json",
    "title": "Example Stack Controller Configuration",
    "instructions": "Provide usage instructions here in markdown format.",
    "fhir_base_url": "http://localhost:8080/fhir",
    "driver": "hapi",
    "links": [
        {
            "name": "FHIR Server",
            "url": "http://localhost:8080"
        }
    ],
    "data": [
        {
            "file": "data/example/hospitalInformation1671557337568.json",
            "load": true,
            "name": "Organization Bundle 1",
            "description": "Synthea-generated Organization records",
            "type": "Organization Bundle",
            "priority": 0
        },
        {
            "file": "data/example/hospitalInformation1671557444542.json",
            "load": true,
            "name": "Organization Bundle 2",
            "description": "Synthea-generated Organization records",
            "type": "Organization Bundle",
            "priority": 1
            
        },
        {
            "file": "data/example/practitionerInformation1671557337568.json",
            "load": true,
            "name": "Practioner Bundle 1",
            "description": "Synthea-generated Practitioner records",
            "type": "Practitioner Bundle",
            "priority": 2
        },
        {
            "file": "data/example/practitionerInformation1671557444542.json",
            "load": true,
            "name": "Practioner Bundle2 ",
            "description": "Synthea-generated Practitioner records",
            "type": "Practitioner Bundle",
            "priority": 3
        },
        {
            "file": "data/example/Patient 1 - Adrian Allen1.json",
            "load": true,
            "name": "Patient 1 - Adrian Allen1",
            "description": "Deidentified patient record from SHARES study.",
            "type": "Patient Bundle",
            "priority": 4
        },
        {
            "file": "data/example/Patient 2 - Beth Brooks2.json",
            "load": true,
            "name": "Patient 2 - Beth Brooks2",
            "description": "Deidentified patient record from SHARES study.",
            "type": "Patient Bundle",
            "priority": 5
        },
        {
            "file": "data/example/Patient 3 - Carmen Chavez.json",
            "load": true,
            "name": "Patient 3 - Carmen Chavez",
            "description": "Deidentified patient record from SHARES study.",
            "type": "Patient Bundle",
            "priority": 6
        },
        {
            "file": "data/example/Patient 4 - Diana Dixon4.json",
            "load": true,
            "name": "Patient 4 - Diana Dixon4",
            "description": "Deidentified patient record from SHARES study.",
            "type": "Patient Bundle",
            "priority": 7
        }
    ]
}